{
 "model": "v0 base rate",
 "n": 0,
 "options": [
  {
   "crowd_pct": null,
   "emoji": "🎬",
   "max_z": 4.2,
   "model_p": 0.11,
   "outcome": "hit",
   "qid": "Q999990041",
   "title": "Test Call Option Hit",
   "url": "https://en.wikipedia.org/wiki/Test_Call_Option_Hit"
  },
  {
   "crowd_pct": null,
   "emoji": "🎬",
   "max_z": 1.1,
   "model_p": 0.08,
   "outcome": "miss",
   "qid": "Q999990042",
   "title": "Test Call Option Miss",
   "url": "https://en.wikipedia.org/wiki/Test_Call_Option_Miss"
  },
  {
   "crowd_pct": null,
   "emoji": "🏛",
   "max_z": null,
   "model_p": 0.09,
   "outcome": "pending",
   "qid": "Q999990043",
   "title": "Test Call Option Pending One",
   "url": null
  },
  {
   "crowd_pct": null,
   "emoji": "🧬",
   "max_z": null,
   "model_p": 0.07,
   "outcome": "pending",
   "qid": "Q999990044",
   "title": "Test Call Option Pending Two",
   "url": null
  }
 ],
 "resolves_on": "2026-10-03",
 "window_end": "2026-10-01",
 "window_start": "2026-09-25"
}
